{
  "manifest_version": 3,
  "deployment_id": "0xf01255713a1b47e710604585f90f8c776458b3ed58d8c50df18894082c104da2",
  "institution_id": "INST-CENTRAL-DEMO",
  "chain_id": 31337,
  "network": "localhost",
  "contract_version": "2.1.0",
  "status": "active",
  "deployed_at": "2026-10-30T10:49:10.132Z",
  "deployed_at_block": 18,
  "confirmation_depth": 2,
  "deployer": "0xf39Fd6e51aad88F6F4ce6aB8827279cffFb92266",
  "bootstrap_finalized": true,
  "addresses": {
    "RoleManager": "0x610178dA211FEF7D417bC0e6FeD39F05609AD788",
    "InsiderActivityLog": "0xB7f8BC63BbcaD18155201308C8f3540b07f84F5e",
    "ForensicTrail": "0xA51c1fc2f0D1a1b8494Ed1FE312d7C3a78Ed91C0",
    "ComplianceRules": "0x0DCd1Bf9A1b36cE34237eEaFef220932846BCD82",
    "MultiSigApproval": "0x8A791620dd6260079BF849Dc5567aDC3F2FdC318",
    "AuditEngine": "0x9A676e781A523b5d0C0e43731313A708CB607508"
  },
  "deployed_code_hashes": {
    "RoleManager": "0xbd3003d859500730abcfa0d9f3d49da1460f44a7892c3faefebfb23ddfe6b415",
    "InsiderActivityLog": "0x8417aecef48651db212f188c48de921a865b995aa646665ee2e495b1f100d126",
    "ForensicTrail": "0x887803b53ccf560a0531f110c0ed3c0adabaa4f89767f7f728de0acaaa712aaf",
    "ComplianceRules": "0xa24e26cbab9b95f1238f7fb4e0cbb4d579f8bae180300512a5093853ddb08e08",
    "MultiSigApproval": "0x35b738aed224ba7a3e067cad9c8a6e4b7187a02e9a4defc72eed37ee2a5a58cb",
    "AuditEngine": "0xbd3a7fb3b6c63f2aa7cc364efdcfa90b63b32ff8f840ae552b9172c84dfa0e41"
  },
  "governance": {
    "required_approvals": 2,
    "proposal_ttl_seconds": 259200,
    "timelock_delay_seconds": 86400,
    "eligible_participants": 4,
    "active_participants": 6
  },
  "participants": [
    {
      "participant_id": "0x2b7d3abfd3f1e5ee89f86a9d0883df9e97e119fbefcf099cfcf9e530127ce6e5",
      "account": "0x70997970C51812dc3A010C7d01b50e0d17dc79C8",
      "role": 1,
      "reason": "SYSTEM: Chief Governance & Compliance Admin"
    },
    {
      "participant_id": "0xa77df04bcb1491d100c248e262a0a81ca4c5709c97fb1a8d393174b4c7183792",
      "account": "0x3C44CdDdB6a900fa2b585dd299e03d12FA4293BC",
      "role": 2,
      "reason": "SYSTEM: Primary Forensic Compliance Auditor"
    },
    {
      "participant_id": "0x0bf2e9f526dc28eb899188d1b5efae7d7d56a54a525ac4be43c145629357a465",
      "account": "0x90F79bf6EB2c4f870365E785982E1f101E93b906",
      "role": 2,
      "reason": "SYSTEM: Secondary Forensic Compliance Auditor"
    },
    {
      "participant_id": "0xe97848baf16709d19d923d04e8c33baa050b05b2a58d85937f23cf7ce4b08e9e",
      "account": "0x15d34AAf54267DB7D7c367839AAf71A00a2C6A65",
      "role": 2,
      "reason": "SYSTEM: Tertiary Forensic Compliance Auditor"
    },
    {
      "participant_id": "0x489a7c855d501a8af86a96c33699c223f2ca0c5b6d16fd8dbec2b64b25ba7361",
      "account": "0x9965507D1a55bcC2695C58ba16FB37d819B0A4dc",
      "role": 3,
      "reason": "SYSTEM: Daily Transaction Operator (non-voting)"
    },
    {
      "participant_id": "0x23e3c413f14d4e3bc8e3b0af179f82c8d4ac9af6281df0b41fee57878acf67b2",
      "account": "0x976EA74026E726554dB657fA54763abd0C3a0aa9",
      "role": 4,
      "reason": "SYSTEM: External Regulator Observer (non-voting)"
    }
  ]
}
